{
  "schema": "ai_teaching_presentation_delivery/v2",
  "session_id": "TS-4242",
  "sequence_id": "PS-0001",
  "ordinal": 1,
  "action_id": "VA-20260903-0001",
  "action": {
    "kind": "voice",
    "voice_action": {
      "action_id": "VA-20260903-0001",
      "decision_id": "TD-20260903-0001",
      "text": "我们先看这两个三角形公共的角。",
      "source": "approved-resource",
      "resource_ref": "RES2",
      "interruptible": true,
      "intent": "narrate"
    }
  },
  "session_revision": 7,
  "execution_owner": {
    "client_instance_id": "browser-visual-0001",
    "epoch": 1
  }
}
